{
  "$schema": "http://json-schema.org/draft-07/schema#",
  "title": "demo-state.json",
  "description": "State machine for the Demo B2C Commerce 11-step orchestrator. Lives in the working dir, gitignored. Secrets are referenced by name, never stored in clear.",
  "type": "object",
  "additionalProperties": false,
  "required": ["client", "b2c", "slas", "sfn", "steps"],
  "properties": {
    "client": {
      "type": "object",
      "additionalProperties": false,
      "required": ["name", "source_url"],
      "properties": {
        "name": { "type": "string", "description": "Display name of the demo client, e.g. 'Nnormal'" },
        "source_url": { "type": "string", "description": "Public website used as branding + catalog source, e.g. 'https://www.nnormal.com'" }
      }
    },
    "b2c": {
      "type": "object",
      "additionalProperties": false,
      "required": ["instance_url", "shortcode", "site_id", "currency", "locale"],
      "properties": {
        "instance_url": { "type": "string", "description": "<sandbox>.dx.commercecloud.salesforce.com" },
        "shortcode": { "type": "string", "description": "8-char realm short code (BM -> Administration -> Site Development -> Salesforce Commerce API Settings)" },
        "organization_id": { "type": "string", "description": "Organization ID shown on the same SCAPI Settings page, e.g. f_ecom_zzse_262. SLAS tenant_id is typically this without the f_ecom_ prefix." },
        "site_id": { "type": "string", "description": "Storefront site id created in BM (case-sensitive). Captured in step 2, not in the intake." },
        "currency": { "type": "string", "description": "ISO currency, e.g. EUR" },
        "locale": { "type": "string", "description": "Default locale, e.g. es-ES" },
        "dw_json_path": { "type": "string", "description": "Absolute path to the dw.json file used by b2c CLI (generated by step 1 intake, gitignored)." },
        "access_setup_done": { "type": "boolean", "description": "True once step 4b (AM scopes + OCAPI Data Settings) verifies with 'b2c sites list' + 'b2c bm whoami'. Skips re-prompts on resumes." }
      }
    },
    "slas": {
      "type": "object",
      "additionalProperties": false,
      "required": ["tenant_id", "client_id_secret", "client_secret_secret"],
      "properties": {
        "tenant_id": { "type": "string", "description": "SLAS tenant = the Organization ID at BM -> Administration -> Site Development -> Salesforce Commerce API Settings, usually without the f_ecom_ prefix (e.g. zzse_262)" },
        "client_id_secret": { "type": "string", "description": "NAME of the SLAS client id env var — never the raw value. Default to the canonical SFN runtime key 'PUBLIC__app__commerce__api__clientId' so step 5's .env bootstrap matches what the SFN template reads at boot. Legacy 'SLAS_CLIENT_ID' is silently ignored by the runtime." },
        "client_secret_secret": { "type": "string", "description": "NAME of the SLAS client secret env var — never the raw value. Default to the canonical SFN runtime key 'COMMERCE_API_SLAS_SECRET'. Legacy 'SLAS_CLIENT_SECRET' causes 'Access token is invalid or revoked' at runtime even when raw curl succeeds." }
      }
    },
    "sfn": {
      "type": "object",
      "additionalProperties": false,
      "required": ["target_repo_path", "mrt_project"],
      "properties": {
        "template_source": {
          "type": "object",
          "additionalProperties": false,
          "description": "Where the SFN template comes from in step 5 (chosen by the user).",
          "properties": {
            "kind": { "type": "string", "enum": ["official-latest", "git-ref", "local-path"], "description": "official-latest = clone SalesforceCommerceCloud/storefront-next-template HEAD; git-ref = a specific repo URL + ref; local-path = reuse an existing local SFN repo" },
            "url": { "type": "string", "description": "Git URL when kind=git-ref (defaults to the official template repo)" },
            "ref": { "type": "string", "description": "Tag/branch/commit when kind=git-ref (e.g. v0.4.0)" },
            "path": { "type": "string", "description": "Existing local repo path when kind=local-path" }
          }
        },
        "target_repo_path": { "type": "string", "description": "Local path where the SFN repo is cloned (output of step 5, input to 7/9)" },
        "mrt_project": { "type": "string", "description": "Managed Runtime project slug for `npm run push`" },
        "mrt_environment": { "type": "string", "description": "MRT environment slug (staging | production | preview). Optional — defaults to the project's default if not set." },
        "mrt_credentials_ready": { "type": "boolean", "description": "True once ~/.mobify is verified to contain {username, api_key}. Re-checked just before step 11." }
      }
    },
    "steps": {
      "type": "object",
      "additionalProperties": false,
      "required": [
        "1_sandbox", "2_site", "3_storefront_bm", "4_slas_creds",
        "5_deploy_sfn", "6_branding", "7_pd_template", "8_pd_content",
        "9_catalog_build", "10_catalog_upload", "11_reindex_push"
      ],
      "patternProperties": {
        "^[0-9]+_[a-z_]+$": {
          "type": "object",
          "additionalProperties": false,
          "required": ["owner", "status"],
          "properties": {
            "owner": { "type": "string", "enum": ["user", "ia"] },
            "status": { "type": "string", "enum": ["pending", "in_progress", "done", "skipped", "blocked"] },
            "skill": { "type": "string", "description": "Sub-skill the master invokes for ia-owned steps" },
            "note": { "type": "string", "description": "Free-form note (e.g. blocker reason, output path)" }
          }
        }
      }
    }
  }
}
